[
  {
    "id": "a-deathnote",
    "name": "Death Note",
    "domain": "anime",
    "year": 2006,
    "genres": [
      "Thriller",
      "Supernatural"
    ],
    "studio": "Madhouse",
    "creator": "Tsugumi Ohba",
    "origin": "Japan",
    "format": "TV Series",
    "source": "Manga",
    "characters": [
      "Light Yagami",
      "L",
      "Ryuk",
      "Misa Amane"
    ],
    "themes": [
      "Justice",
      "Cat and mouse"
    ],
    "credits": [
      "Story: Tsugumi Ohba",
      "Art: Takeshi Obata",
      "Director: Tetsurō Araki"
    ],
    "fandom": "deathnote",
    "cover": {
      "wiki": "Death Note",
      "image": "https://upload.wikimedia.org/wikipedia/en/6/6f/Death_Note_Vol_1.jpg"
    },
    "quote": {
      "text": "I'll take a potato chip... and eat it!",
      "speaker": "A high-school genius with a secret"
    },
    "audio": {
      "clue": "A heavy, operatic rock opening with a pipe organ and a choir, sung by a visual-kei band.",
      "query": "Death Note opening The World Nightmare",
      "youtubeId": "D7MMMNTQ7H0"
    },
    "emoji": "📓🍎✍️💀🕵️",
    "item": {
      "name": "A black notebook",
      "description": "Write a name inside while picturing the face, and that person dies.",
      "src": "fandom:deathnote:Death Note (object)"
    },
    "location": {
      "name": "Task Force headquarters",
      "description": "A purpose-built high-rise packed with monitors, funded by a sweets-loving detective.",
      "image": "https://static.wikia.nocookie.net/deathnote/images/d/df/Ep_18_task_force_hq.jpg/revision/latest/scale-to-width-down/640?cb=20190219173315"
    },
    "visual": {
      "icon": "🍎",
      "colors": [
        "#0a0a0a",
        "#dc2626"
      ]
    }
  },
  {
    "id": "a-naruto",
    "name": "Naruto",
    "domain": "anime",
    "year": 2002,
    "genres": [
      "Action",
      "Shōnen"
    ],
    "studio": "Pierrot",
    "creator": "Masashi Kishimoto",
    "origin": "Japan",
    "format": "TV Series",
    "source": "Manga",
    "characters": [
      "Naruto Uzumaki",
      "Sasuke Uchiha",
      "Kakashi Hatake"
    ],
    "themes": [
      "Ninja",
      "Rivalry",
      "Loneliness"
    ],
    "credits": [
      "Original manga: Masashi Kishimoto",
      "Director: Hayato Date",
      "Composer: Toshio Masuda"
    ],
    "fandom": "naruto",
    "cover": {
      "wiki": "Naruto",
      "image": "https://upload.wikimedia.org/wikipedia/en/9/94/NarutoCoverTankobon1.jpg"
    },
    "quote": {
      "text": "Believe it!",
      "speaker": "An orange-clad loudmouth (English dub catchphrase)"
    },
    "audio": {
      "clue": "A mournful shamisen-and-flute piece that plays whenever the lonely hero remembers his childhood.",
      "query": "Naruto Sadness and Sorrow",
      "youtubeId": "wEWF2xh5E8s"
    },
    "emoji": "🍥🦊🍜🥷🍃",
    "item": {
      "name": "Leaf forehead protector",
      "description": "A metal plate on a cloth band, engraved with a leaf-spiral symbol.",
      "src": "fandom:naruto:Forehead Protector",
      "image": "https://static.wikia.nocookie.net/naruto/images/f/fc/Forehead_Protector.png/revision/latest/scale-to-width-down/640?cb=20160116193641"
    },
    "location": {
      "name": "Hidden Leaf Village",
      "description": "A forest village beneath a cliff carved with the faces of its leaders.",
      "src": "fandom:naruto:Konohagakure",
      "image": "https://static.wikia.nocookie.net/naruto/images/3/34/Konohagakure.png/revision/latest/scale-to-width-down/640?cb=20160728115517"
    },
    "visual": {
      "icon": "🍥",
      "colors": [
        "#ea580c",
        "#1e3a8a"
      ]
    }
  },
  {
    "id": "a-onepiece",
    "name": "One Piece",
    "domain": "anime",
    "year": 1999,
    "genres": [
      "Adventure",
      "Shōnen"
    ],
    "studio": "Toei Animation",
    "creator": "Eiichiro Oda",
    "origin": "Japan",
    "format": "TV Series",
    "source": "Manga",
    "characters": [
      "Monkey D. Luffy",
      "Roronoa Zoro",
      "Nami"
    ],
    "themes": [
      "Pirates",
      "Freedom",
      "Friendship"
    ],
    "credits": [
      "Original manga: Eiichiro Oda",
      "Composers: Kohei Tanaka & Shiro Hamaguchi",
      "Serialised in Weekly Shōnen Jump since 1997"
    ],
    "fandom": "onepiece",
    "cover": {
      "wiki": "One Piece",
      "image": "https://upload.wikimedia.org/wikipedia/en/9/90/One_Piece%2C_Volume_61_Cover_%28Japanese%29.jpg"
    },
    "quote": {
      "text": "I'm gonna be King of the Pirates!",
      "speaker": "A rubber-bodied captain"
    },
    "audio": {
      "clue": "An upbeat, sing-along first opening about setting sail in search of the ultimate treasure.",
      "query": "One Piece opening 1 We Are",
      "youtubeId": "YoeP9w5UIlg"
    },
    "emoji": "🏴‍☠️👒🍖🌊💰",
    "item": {
      "name": "Straw hat",
      "description": "A simple hat with a red band, promised to be returned to a red-haired pirate.",
      "image": "https://static.wikia.nocookie.net/onepiece/images/b/b2/Straw_Hat.png/revision/latest/scale-to-width-down/640?cb=20231119104349"
    },
    "location": {
      "name": "The Grand Line",
      "description": "A dangerous sea route circling the world, guarded by calm belts full of sea kings.",
      "src": "fandom:onepiece:Grand Line",
      "image": "https://static.wikia.nocookie.net/onepiece/images/4/41/Grand_Line_Infobox.png/revision/latest/scale-to-width-down/640?cb=20220803103019"
    },
    "visual": {
      "icon": "👒",
      "colors": [
        "#0369a1",
        "#fde047"
      ]
    }
  },
  {
    "id": "a-eva",
    "name": "Neon Genesis Evangelion",
    "aliases": [
      "evangelion",
      "eva",
      "nge"
    ],
    "domain": "anime",
    "year": 1995,
    "genres": [
      "Mecha",
      "Psychological"
    ],
    "studio": "Gainax",
    "creator": "Hideaki Anno",
    "origin": "Japan",
    "format": "TV Series",
    "source": "Original",
    "characters": [
      "Shinji Ikari",
      "Rei Ayanami",
      "Asuka Langley Soryu"
    ],
    "themes": [
      "Depression",
      "Apocalypse"
    ],
    "credits": [
      "Director: Hideaki Anno",
      "Character design: Yoshiyuki Sadamoto",
      "Composer: Shirō Sagisu"
    ],
    "fandom": "evangelion",
    "cover": {
      "wiki": "Neon Genesis Evangelion",
      "image": "https://upload.wikimedia.org/wikipedia/en/7/72/Evangelion_retouched.png"
    },
    "quote": {
      "text": "I mustn't run away.",
      "speaker": "A reluctant 14-year-old pilot"
    },
    "audio": {
      "clue": "A fast, dramatic J-pop opening whose title translates roughly to a cruel angel's thesis.",
      "query": "A Cruel Angel's Thesis Evangelion opening",
      "youtubeId": "nU21rCWkuJw"
    },
    "emoji": "🤖👦😰✝️🌊",
    "item": {
      "name": "Lance of Longinus",
      "description": "A colossal red, twin-pronged spear hurled into orbit.",
      "src": "fandom:evangelion:Lance of Longinus",
      "image": "https://static.wikia.nocookie.net/evangelion/images/5/5d/Lance_of_Longinus.png/revision/latest/scale-to-width-down/640?cb=20120320234343"
    },
    "location": {
      "name": "Tokyo-3",
      "description": "A fortress city whose skyscrapers retract underground during attacks.",
      "src": "none"
    },
    "visual": {
      "icon": "🤖",
      "colors": [
        "#4c1d95",
        "#84cc16"
      ]
    }
  },
  {
    "id": "a-spiritedaway",
    "name": "Spirited Away",
    "domain": "anime",
    "year": 2001,
    "genres": [
      "Fantasy",
      "Family"
    ],
    "studio": "Studio Ghibli",
    "creator": "Hayao Miyazaki",
    "origin": "Japan",
    "format": "Film",
    "source": "Original",
    "characters": [
      "Chihiro",
      "Haku",
      "No-Face",
      "Yubaba"
    ],
    "themes": [
      "Spirits",
      "Growing up"
    ],
    "credits": [
      "Writer & director: Hayao Miyazaki",
      "Composer: Joe Hisaishi",
      "Producer: Toshio Suzuki"
    ],
    "fandom": "ghibli",
    "cover": {
      "wiki": "Spirited Away",
      "image": "https://upload.wikimedia.org/wikipedia/en/d/db/Spirited_Away_Japanese_poster.png"
    },
    "quote": {
      "text": "Once you've met someone, you never really forget them.",
      "speaker": "A kindly old witch"
    },
    "audio": {
      "clue": "A tender piano waltz that opens as a girl rides a train across a flooded sea.",
      "query": "Spirited Away One Summer's Day Joe Hisaishi",
      "youtubeId": "TK1Ij_-mank"
    },
    "emoji": "👧🐉🛁👻🐷",
    "item": {
      "name": "A golden-coin offering",
      "description": "Gold that a masked, silent spirit conjures from its hands for greedy workers."
    },
    "location": {
      "name": "The spirit bathhouse",
      "description": "A towering red bathhouse where gods come to wash, run by a big-headed witch.",
      "src": "fandom:ghibli:Aburaya",
      "image": "https://static.wikia.nocookie.net/studio-ghibli/images/8/80/Chihiro_sees_the_Bathhouse.png/revision/latest/scale-to-width-down/513?cb=20200914124155"
    },
    "visual": {
      "icon": "🐉",
      "colors": [
        "#7f1d1d",
        "#fca5a5"
      ]
    }
  },
  {
    "id": "a-aot",
    "name": "Attack on Titan",
    "aliases": [
      "shingeki no kyojin",
      "snk",
      "aot"
    ],
    "domain": "anime",
    "year": 2013,
    "genres": [
      "Dark Fantasy",
      "Action"
    ],
    "studio": "Wit Studio",
    "creator": "Hajime Isayama",
    "origin": "Japan",
    "format": "TV Series",
    "source": "Manga",
    "characters": [
      "Eren Yeager",
      "Mikasa Ackerman",
      "Levi"
    ],
    "themes": [
      "War",
      "Freedom",
      "Giants"
    ],
    "credits": [
      "Original manga: Hajime Isayama",
      "Director: Tetsurō Araki",
      "Composer: Hiroyuki Sawano"
    ],
    "fandom": "attackontitan",
    "cover": {
      "wiki": "Attack on Titan",
      "image": "https://upload.wikimedia.org/wikipedia/en/d/d6/Shingeki_no_Kyojin_manga_volume_1.jpg"
    },
    "quote": {